{
	"id": "v04-cicd-realized",
	"title": "Fully realized CI/CD on main",
	"description": "Green superrepo workflows: setup-beskid-web composite, trudoc verify via web workspace, nexus Docker/native smoke, tracker/auth container builds, security audits, and verify-all-on-main evidence after v0.4 landings.\n\n## Provenance\n- **Catalog cutoff:** [`aaddd32`](https://github.com/Cyber-Nomad-Collective/beskid/commit/aaddd32) → [`ee88edf`](https://github.com/Cyber-Nomad-Collective/beskid/commit/ee88edf) on **beskid** (2026-05-26 – 2026-06-07)\n- **Anchor commit:** [`1b0a15c`](https://github.com/Cyber-Nomad-Collective/beskid/commit/1b0a15c)\n\n## Catalog scope\n- **Delivery version:** v0.4 (Platform services, auth, and delivery tooling)\n- **Status:** Partial — web CI, nexus smoke, tracker container CI (platform-infra), and lazygit landed; verify-all-on-main backlog\n- **Workstreams:** `repo-cicd`, `nexus`, `platform-infra`",
	"subtasks": [],
	"$schema": "../schemas/seed/deliverable.schema.json"
}
